{
  "schema_version": "0.1",
  "session_id": "did-2026-07-19-001",
  "source_agent": "Claude Code (cloud review)",
  "environment": "Claude Code cloud — tool-limited review session",
  "tools_available": [
    { "category": "shell", "available": false },
    { "category": "filesystem", "available": false },
    { "category": "network", "available": false },
    { "category": "connector", "available": false },
    { "category": "browser", "available": false },
    { "category": "test_runner", "available": false },
    { "category": "deployment", "available": false },
    { "category": "write_access", "available": false },
    { "category": "git", "available": false },
    { "category": "coordination_bus", "available": false },
    { "category": "durable_memory", "available": false },
    { "category": "artifact_creation", "available": true }
  ],
  "repository_or_system_scope": "hummbl-dev/hummbl-production#747",
  "starting_state": "Issue #747 open with a candidate defect report requiring review.",
  "actions_attempted": [
    "Reviewed issue #747 context and code references",
    "Analyzed the candidate defect claim",
    "Produced a durable handoff with bounded verification steps"
  ],
  "mutations_made": {
    "records": [
      { "type": "branch", "created": false },
      { "type": "commit", "created": false },
      { "type": "pr", "created": false },
      { "type": "issue", "created": false },
      { "type": "file", "created": false },
      { "type": "deployment", "created": false }
    ],
    "summary": "No mutations made. This was a read-only review session."
  },
  "claims": [
    {
      "statement": "The candidate defect in #747 is plausible but unconfirmed without local reproduction.",
      "posture": "provisional",
      "evidence": "Code path analysis from issue description; no local execution performed."
    },
    {
      "statement": "The review environment lacked shell, filesystem, and test-runner access.",
      "posture": "observed",
      "evidence": "Tool availability declarations in this receipt."
    }
  ],
  "decisions": [
    "Convert the review into a durable handoff with explicit provenance and bounded verification steps.",
    "Do not claim the defect is confirmed without local reproduction."
  ],
  "negative_knowledge": [
    "no code changed",
    "no branch created",
    "no commit made",
    "environment lacked shell, filesystem, and test-runner tools",
    "defect not confirmed — provisional only"
  ],
  "open_questions": [
    "Does the candidate defect reproduce in a local environment with shell and test-runner access?"
  ],
  "next_actions": [
    {
      "action": "Reproduce the candidate defect locally with shell and test-runner access.",
      "disposition": "INCONCLUSIVE",
      "owner": "receiving-agent"
    }
  ],
  "authority_boundaries": {
    "scope": "advisory review only — no write access, no deployment authority",
    "constraints": [
      "Cannot merge, deploy, or modify code",
      "Cannot create issues or PRs",
      "Handoff is advisory only — receiving agent must verify before acting"
    ]
  },
  "receipt_destination": {
    "type": "github_issue",
    "locator": "https://github.com/hummbl-dev/hummbl-production/issues/747"
  },
  "completion_status": "complete"
}
